{
  "$schema": "https://json-schema.org/draft/2020-12/schema",
  "$id": "https://schemas.aegiscudo.local/policy.schema.json",
  "title": "AegiscudoPolicyProfile",
  "type": "object",
  "additionalProperties": false,
  "required": ["id", "tenant_id", "version", "mode", "minimum_release_age_hours", "known_vulnerability_threshold", "fail_closed", "rules"],
  "properties": {
    "id": { "type": "string", "format": "uuid" },
    "tenant_id": { "type": "string", "format": "uuid" },
    "version": { "type": "string", "minLength": 1 },
    "mode": { "enum": ["shadow", "warn", "enforce"] },
    "minimum_release_age_hours": { "type": "integer", "minimum": 0 },
    "known_vulnerability_threshold": {
      "type": "object",
      "additionalProperties": false,
      "required": ["severity_floor", "kev_override"],
      "properties": {
        "severity_floor": { "enum": ["low", "medium", "high", "critical"] },
        "kev_override": { "type": "boolean" },
        "epss_probability_floor": { "type": "number", "minimum": 0, "maximum": 1 }
      }
    },
    "scorecard_thresholds": {
      "type": "object",
      "additionalProperties": false,
      "properties": {
        "code_review": { "type": "number", "minimum": -1, "maximum": 10 },
        "branch_protection": { "type": "number", "minimum": -1, "maximum": 10 },
        "ci_cd": { "type": "number", "minimum": -1, "maximum": 10 },
        "maintained": { "type": "number", "minimum": -1, "maximum": 10 },
        "signed_releases": { "type": "number", "minimum": -1, "maximum": 10 }
      }
    },
    "fail_closed": { "type": "boolean" },
    "rules": {
      "type": "array",
      "items": {
        "type": "object",
        "additionalProperties": false,
        "required": ["id", "signal", "action", "enabled"],
        "properties": {
          "id": { "type": "string", "minLength": 1 },
          "signal": { "type": "string", "minLength": 1 },
          "action": { "enum": ["allow", "warn", "quarantine", "block", "hitl", "fallback"] },
          "enabled": { "type": "boolean" }
        }
      }
    }
  }
}